{
  "args": [
    {
      "steps": [
        {
          "name": "alpha"
        },
        {
          "name": "beta"
        },
        {
          "name": "gamma"
        }
      ]
    },
    "gamma"
  ],
  "expected_output": true,
  "idiom": "udf",
  "input_bindings": {
    "step_name": "gamma",
    "trace": {
      "steps": [
        {
          "name": "alpha"
        },
        {
          "name": "beta"
        },
        {
          "name": "gamma"
        }
      ]
    }
  },
  "input_expression": "relay.coverage(trace, step_name)",
  "label": "udf_cov_last_match",
  "py_jcs_b64": "dHJ1ZQ==",
  "udf": "relay.coverage"
}
