{
  "args": [
    "caf\u00e9",
    {
      "type": "string"
    }
  ],
  "edge_category": "unicode",
  "expected_output": true,
  "idiom": "udf",
  "input_bindings": {
    "payload": "caf\u00e9",
    "schema": {
      "type": "string"
    }
  },
  "input_expression": "relay.schema_match(payload, schema)",
  "label": "udf_sm_unicode_payload",
  "py_jcs_b64": "dHJ1ZQ==",
  "udf": "relay.schema_match"
}
