{
  "args": [
    {},
    "k"
  ],
  "edge_category": "empty",
  "expected_output": null,
  "idiom": "udf",
  "input_bindings": {
    "call": {},
    "key": "k"
  },
  "input_expression": "relay.tool_arg(call, key)",
  "label": "udf_arg_no_args",
  "py_jcs_b64": "bnVsbA==",
  "udf": "relay.tool_arg"
}
