{
  "args": [
    {
      "args": {
        "b": true
      }
    },
    "b"
  ],
  "expected_output": true,
  "idiom": "udf",
  "input_bindings": {
    "call": {
      "args": {
        "b": true
      }
    },
    "key": "b"
  },
  "input_expression": "relay.tool_arg(call, key)",
  "label": "udf_arg_bool_true",
  "py_jcs_b64": "dHJ1ZQ==",
  "udf": "relay.tool_arg"
}
