{
  "args": [
    {
      "args": {
        "x": null
      }
    },
    "x"
  ],
  "expected_output": null,
  "idiom": "udf",
  "input_bindings": {
    "call": {
      "args": {
        "x": null
      }
    },
    "key": "x"
  },
  "input_expression": "relay.tool_arg(call, key)",
  "label": "udf_arg_null_value",
  "py_jcs_b64": "bnVsbA==",
  "udf": "relay.tool_arg"
}
